url,input
https://www.fightbookmma.com/japans-kaito-ono-challenges-tyjani-beztati-at-glory-87,"Beztati won the vacant title back at GLORY 78 thanks to a unanimous decision victory over America’s Elvis Gashi and has defended the title three times in total since. Most recently, the 25-year-old put on a flawless, career-defining performance defeating featherweight champ Petch and securing his spot as arguably the best lightweight on the planet today."
https://www.fightbookmma.com/japans-kaito-ono-challenges-tyjani-beztati-at-glory-87,"This fight will serve as the co-main event of the evening which will feature a thrilling four-man one-night heavyweight tournament. Martin Terpstra (21-5, 11 KO), Mohamed Amine (29-5, 16 KO), Bahram Rajabzadeh (62-1, 56 KO), and Uku Jürjendal (18-7, 14 KO) will all compete for a chance to enter the historic GLORY Heavyweight Grand Prix this December."
https://www.fightbookmma.com/collision-5-results-osaro-upsets-on-a-night-of-champions,"Tariq ‘Cookie’ Osaro (25-2-1, 13 KO) caused a huge upset in the main event as he defeated friend & teammate Antonio Plazibat (22-5, 16 KO) with an emphatic fifth-round finish to capture the interim GLORY heavyweight title. In doing so, he made history by becoming the first ever Nigerian to become a GLORY champion."
https://www.fightbookmma.com/collision-5-results-osaro-upsets-on-a-night-of-champions,"In the co-main event, Tarik Khbabez (49-10-1, 27 KO) stopped a valiant Mohamed Amine (29-5, 16 KO) in the fourth round to become the interim GLORY light heavyweight champion. Khbabez was originally set to face Donegi Abena, however, the champ withdrew due to an illness during fight week and in-stepped Amine for the newly created interim title."
https://www.fightbookmma.com/collision-5-results-osaro-upsets-on-a-night-of-champions,"Middleweight champion Donovan Wisse (18-1, 10 KO) reminded everyone just why he is one of the P4P best in the world with a complete shutout victory over Turkey’s Serkan Ozcaglayan (45-7, 36 KO)."
https://www.fightbookmma.com/collision-5-results-osaro-upsets-on-a-night-of-champions,"Elsewhere on the main card, Ibrahim El Bouni (41-8-1, 22 KO) improved to 4-0 in GLORY with a clinical decision over Brazil’s Felipe Micheletti (17-11, 5 KO) and, kicking-off the PPV, Michael Boapeah (15-3-1, 7 KO) knocked Ulric Bokeme’s (31-4, 17 KO) teeth out in the first round."
https://www.fightbookmma.com/collision-5-results-osaro-upsets-on-a-night-of-champions,"In the COLLISION 5 prelims, big Nabil Khachab (26-4-1, 4 KO) scored a dominant victory over German veteran Vladimir Tok (51-19, 28 KO), France’s Diaguely Camara (23-4-1, 10 KO) stopped Eduard Gafencu (17-4, 11 KO) with a knee in the second round, and Croatia’s Andrej Kedves (19-4, 7 KO) defeated Mareks Pelcis (10-3, 5 KO) with an entertaining decision victory in the opening bout of the night."
https://www.fightbookmma.com/tiffany-van-soest-vs-sarah-moussaddak-2-set-for-glory-88-in-paris,"Considered by many to be the P4P best female kickboxer on the planet, van Soest is reigning and defending GLORY women’s super bantamweight champion. The American is a two-time GLORY champion and is currently on a five-fight win streak which includes her triumphant victory over Anissa Meksen to regain her crown at GLORY 71 in Chicago."
https://www.fightbookmma.com/tiffany-van-soest-vs-sarah-moussaddak-2-set-for-glory-88-in-paris,This loss has only added fuel to the fire for Moussaddak and the French Moroccan bounced back with a dominant win over Giuliana Cosnard at GLORY 86. Heading into the fight the 23-year-old had her eyes focused on the rematch with van Soest and used it as motivation.
https://www.fightbookmma.com/tiffany-van-soest-vs-sarah-moussaddak-2-set-for-glory-88-in-paris,Now the duo will finally settle the score once and for all at GLORY 88 on September 9 at the Dome De Paris in France.
https://www.fightbookmma.com/fightbookmmas-box-office,FightBook MMA Box Office is where you can buy tickets for all your Combat Sports Events and Concerts
https://www.fightbookmma.com/fightbookmmas-box-office,"Scroll down so you can find any upcoming MMA, Boxing, and UFC & Concerts near you."
https://www.fightbookmma.com/karate-combat-39-results,"The main event saw Luiz Rocha defends his belt Bruno Souza. The co-main event comes in the middleweight division, as Raymond Daniels took on UFC veteran Sasha Palatnikov."
https://www.fightbookmma.com/miami-to-host-three-event-karate-combat-series-starting-april-1,"MediaPro Studios will serve as the host venue for the hottest property in combat sports when it returns to Miami with its unparalleled live event experience, blending live action with CGI virtual production built on Epic Games’ Unreal Engine."
https://www.fightbookmma.com/miami-to-host-three-event-karate-combat-series-starting-april-1,Middleweight champion ‘Turbo’ Ross Levine will lay his belt on the line against Spanish antagonist Igor ‘The Iberian Bull’ de Castaneda in a fight which will reignite one of the most intense rivalries in Karate Combat history.
https://www.fightbookmma.com/miami-to-host-three-event-karate-combat-series-starting-april-1,"When Levine and De Castaneda were first matched in a title-shot eliminator in Karate Combat: Season 4, the dislike was instant and mutual. When De Castaneda took issue with Levine’s “arrogant” social media posts, a war of words turned into a feud which led to the two having to be separated at a press conference before a heated battle which Levine won by TKO."
https://www.fightbookmma.com/miami-to-host-three-event-karate-combat-series-starting-april-1,"In the co-headline bout, Irish bantamweight champion Eoghan Chelmiah and Peru’s Jesus Lopez will pick up where they left off in December, when their five-round KC 37 title war concluded with an officiating error which saw Lopez incorrectly announced as the winner when the scorecard totals actually favored Chelmiah."
https://www.fightbookmma.com/miami-to-host-three-event-karate-combat-series-starting-april-1,Fuel was added to the fire due to many of the crowd – and live broadcast viewership – feeling that the judges should have had Lopez as the winner of the fight in the first place. Certainly the Peruvian gave Chelmiah by far the toughest test of his Karate Combat career to date – and now heads into the rematch inflamed by a sense of injustice.
https://www.fightbookmma.com/karate-combat-statement-on-chelmiah-vs-lopez-ii-fight-cancellation,Karate combat will attempt to reschedule chelmiah vs lopez ii pending medical fitness.
https://www.fightbookmma.com/karate-combat-statement-on-chelmiah-vs-lopez-ii-fight-cancellation,"As Jesus Lopez has made weight in the Karate Combat bantamweight division multiple times in the recent past, the organization will attempt to reschedule the bout in the near future, pending medical fitness."
https://www.fightbookmma.com/wpautoterms/adchoices,The Web sites you visit work with online advertising companies to provide you with advertising that is as relevant and useful as possible. Some of the ads you receive on Web pages are customized based on predictions about your interests generated from your visits over time and across different Web sites. This site is in compliance with the Self-Regulatory Program for Online Behavioral Advertising. The goal of Ad Choices is to provide you with information about how online advertising works and the choices you have.
https://www.fightbookmma.com/wpautoterms/adchoices,Please read about FightBook MMA’s practices in its privacy policy.
https://www.fightbookmma.com/wpautoterms/adchoices,What choices do I have about interest-based advertising on this site?
https://www.fightbookmma.com/wpautoterms/adchoices,Visit the http://www.aboutads.info/choices page to learn more about online behavioral advertising and to see your opt-out choices from companies that are participants in the Self-Regulatory Program for Online Behavioral Advertising.
https://www.fightbookmma.com/wpautoterms/adchoices,"Note: If you choose to opt out, you will still see ads, but these ads will not be customized based on your interests generated from your visits over time and across different Web sites."
https://www.fightbookmma.com/contact-us,"If you have any questions or concerns or just need to reach out to the staff, you can email FightBook MMA and we will get back to you as soon as possible."
https://www.fightbookmma.com/awards-received,"The FightBook MMA Team would like to thank everyone for your continued support. Without y’all, we wouldn’t have won these awards. Scroll down to take a look at our accomplishments so far. From all of us here at FightBook MMA, LLC, we want to say Thank you!!"
https://www.fightbookmma.com/awards-received,"Awarded Top 50 MMA Blogs 2018, 2019, 2020, 2021, 2022, 2023"
https://www.fightbookmma.com/awards-received,"Awarded Top 40 Boxing Blogs 2018, 2019, 2020, 2021, 2022, 2023"
https://www.fightbookmma.com/awards-received,Best International Combat Sports News Platform 2019
https://www.fightbookmma.com/awards-received,Most Outstanding International Combat Sports News Platform 2021
https://www.fightbookmma.com/8-fantastic-jobs-for-mma-fighters,These positions can offer schedule flexibility as long as you attend sales meetings and meet quotas. Sales jobs can range from selling a few products to individuals to substantial enterprise sales.
https://www.fightbookmma.com/8-fantastic-jobs-for-mma-fighters,"With this position, you help individuals get in better shape and keep yourself active throughout the day. You can offer your services through a gym or run a personal training business out of your home. If you have the space, equipment and clientele, a home business may be a more lucrative option since you can manage all the income."
https://www.fightbookmma.com/8-fantastic-jobs-for-mma-fighters,"Serving at a restaurant is another fantastic option. Not only are you staying active on your feet for the entire shift but this job also offers schedules outside the standard 8 to 5, giving you more flexibility to work around your fight schedule. Plus, depending on the restaurant, many servers can make a couple hundred dollars in one shift."
https://www.fightbookmma.com/8-fantastic-jobs-for-mma-fighters,"If you love whipping up baked good and sweet treats, a baker may be the perfect position for you. You get to hone your craft of developing tantalizing treats and also get a schedule that balances well with your nightly fights. Since most bakers start early in the morning, this leaves you more time to dedicate to your training and fights in the evenings."
https://www.fightbookmma.com/8-fantastic-jobs-for-mma-fighters,"Many large retail stores need stockers to unload goods and keep them organized. Plus, many stockers have early morning shifts since the stores need to be ready to go before opening. Stocking not only keeps you active during your shift but also leaves evenings open for your MMA fights."
https://www.fightbookmma.com/bkfc-49-fight-card-set-for-friday-august-25,"Ticket information for BKFC-49 can be found at BKFC.com. The Miami Dade Fairgrounds are located at 10901 SW 24th Street, Miami, FL 33165. BKFC-49 will also be broadcast internationally as part of the BKFC+ Subscription for $7.99 per month on the New BKFC App – The Best Value in Combat Sports and is sponsored by Bucked Up, MIT 45, Only Fans, Crescent Tools, LIONS NOT SHEEP and Knockout Gummies."
https://www.fightbookmma.com/bkfc-49-fight-card-set-for-friday-august-25,"After compiling an 8-2 record as a professional boxer, the 29-year-old Slaveski made his BKFC debut on April 21, 2022 scoring a show stopping first round knockout of Ramal Amanov at BKFC Fight Night: Fort Lauderdale. The heavy handed Slaveski followed that up with quick knockouts of Juston Stills (BKFC-26) and Dallas Davison (BKFC-29). Fighting often, he won a dominant unanimous decision over Evgeny Kurdanov at BKFC-31 and most recently stopped Yordenis Cedeno in the fourth round at BKFC-35. The victory capped off Slaveski’s extraordinary run of five victories in a nine-month span solidifying his reputation as a must-see attraction."
https://www.fightbookmma.com/bkfc-49-fight-card-set-for-friday-august-25,"Hard-hitting Jake Lindsey enters the squared circle for the world title clash following a tremendous fourth round knockout of heralded Connor Tierney at BKFC-37 on March 4, 2023. His three prior BKFC victories were all by exciting stoppage including Brandon Girtz (BKFC-31), Derrick Findley (BKFC-23), and Eric Thompson (BKFC Fight Night: Wichita)."
https://www.fightbookmma.com/bkfc-49-fight-card-set-for-friday-august-25,"The all-action Grant also holds exciting victories over Anthony Retic (BKFC Fight Night New York 2), Travis Thompson (BKFC-18), Brandon Lambert (KnuckleMania 1), Chris Johnson (BKFC-14), and Josh Boudreaux (BKFC-12)."
https://www.fightbookmma.com/bkfc-launches-new-prospects-series-on-thursday-august-24-at-miami-dade-fairgrounds,"Said David Feldman, President and Founder of BKFC, “The BKFC Prospects Series will be a monthly event taking place at the same location the night before our numbered shows. It’s a great opportunity to showcase men and women from boxing, muay thai and mixed martial arts, some of whom have participated in our open tryouts. Let bare-knuckle fans see if you have what it takes under the bright lights to earn a shot at a BKFC contract.”"
https://www.fightbookmma.com/bkfc-launches-new-prospects-series-on-thursday-august-24-at-miami-dade-fairgrounds,"Tickets starting at $40 for BKFC Prospects Series 1 may be purchased at BKFC.com. The Miami Dade Fairgrounds are located at 10901 SW 24th Street, Miami, FL 33165. BKFC Prospects Series 1 will also be broadcast internationally as part of the BKFC+ Subscription for $7.99 per month on the New BKFC App – The Best Value in Combat Sports and is sponsored by Bucked Up, MIT 45, Only Fans, Crescent Tools, LIONS NOT SHEEP and Knockout Gummies."
https://www.fightbookmma.com/bkfc-launches-new-prospects-series-on-thursday-august-24-at-miami-dade-fairgrounds,"BKFC-49 on Friday, August 25 from the Arnold Hall at the Miami Dade Fairgrounds is headlined by the highly anticipated BKFC Welterweight World Championship between #1 Ranked Gorjan ‘GoGo’ Slaveski, (5-0), of Macedonia now residing in South Florida and #4 Ranked ‘Gypsy’ Jake Lindsey, (4-0), of Manhattan, Kansas."
https://www.fightbookmma.com/write-for-us,FightBook MMA is always looking for contributors who would like to be part of our team. At this time we DON’T offer financial compensation for your submissions. Compensation is yours in the way of an opportunity for you to be published online and gain increased exposure to your material. We’re open to almost any type of writing. Your articles will be shared on all social media platforms. You will have the opportunity to cover events in your area by receiving a Press Media Pass (not a guarantee).
https://www.fightbookmma.com/write-for-us,"We want you to gain exposure and gain NEW readers. We have a faithful following and supporters and WE WANT to help promote YOU and YOUR work in any way we can. We are looking for original work with fresh ideas, clean, concise writing. We ask that you proofread your articles before sending them to us by going to our CONTACT US PAGE."
https://www.fightbookmma.com/wpautoterms/privacy-policy,"FightBook MMA (“us”, “we”, or “our”) operates the FightBook MMA website (the “Service”)."
https://www.fightbookmma.com/wpautoterms/privacy-policy,We will not use or share your information with anyone except as described in this Privacy Policy.
https://www.fightbookmma.com/wpautoterms/privacy-policy,"We may employ third-party companies and individuals to facilitate our Service, to provide the Service on our behalf, to perform Service-related services, or to assist us in analyzing how our Service is used."
https://www.fightbookmma.com/wpautoterms/privacy-policy,"Our Service may contain links to other sites that are not operated by us. If you click on a third-party link, you will be directed to that third-party’s site. We strongly advise you to review the Privacy Policy of every site you visit."
https://www.fightbookmma.com/wpautoterms/privacy-policy,Our Service does not address anyone under the age of 18 (“Children”).
https://www.fightbookmma.com/wpautoterms/terms-and-conditions,Our Service may contain links to third-party websites or services that are not owned or controlled by FightBookMMA.com.
https://www.fightbookmma.com/wpautoterms/terms-and-conditions,We strongly advise you to read the terms and conditions and privacy policies of any third-party websites or services that you visit.
https://www.fightbookmma.com/wpautoterms/terms-and-conditions,"All provisions of the Terms which by their nature should survive termination shall survive termination, including, without limitation, ownership provisions, warranty disclaimers, indemnity, and limitations of liability."
https://www.fightbookmma.com/wpautoterms/terms-and-conditions,"Our failure to enforce any right or provision of these Terms will not be considered a waiver of those rights. If any provision of these Terms is held to be invalid or unenforceable by a court, the remaining provisions of these Terms will remain in effect. These Terms constitute the entire agreement between us regarding our Service, and supersede and replace any prior agreements we might have between us regarding the Service."
https://www.fightbookmma.com/wpautoterms/terms-and-conditions,"By continuing to access or use our Service after those revisions become effective, you agree to be bound by the revised terms. If you do not agree to the new terms, please stop using the Service."
https://www.fightbookmma.com/advertise-with-us,FightBookMMA.com would like to thank you for your interest in advertising with us. Our website covers everything Combat Sports-related from promotions around the world.
https://www.fightbookmma.com/advertise-with-us,On average we publish anywhere from 5 to 15 articles daily. We continue to grow on all social media platforms.
https://www.fightbookmma.com/advertise-with-us,"For more information on the options we offer, shoot us an email (support@fightbookmma.com) and we will get back to you A.S.A.P."
https://www.fightbookmma.com/about-us,"FightBookMMA.com is the only place where you’ll find Real Combat Sports News from all over the world. We’re not your Breaking News Outlet but what we do is keep you informed on the latest news. We’re a website you can trust with accurate news from MMA, Kickboxing, Muay Thai, Boxing, and Professional Wrestling. We continue to grow and our fan base continues to grow on all our social media platforms. We are nationally and internationally known with dedicated fans that support us. We have a close relationship with many fighters, promoters, managers, and staff from very well-known organizations."
https://www.fightbookmma.com/bkfc-48-lorenzo-hunt-and-chris-camozzi-to-corner-for-bryce-hall-and-gee-perez-on-august-11-in-albuquerque-nm,"The #2 Ranked Pound-for-Pound Fighter in BKFC and holder of the Cruiserweight and Light Heavyweight BKFC World Titles, Lorenzo Hunt has been leading the training camp for Bryce Hall in Los Angeles for the last two months. Gee Perez has brought Chris Camozzi aboard to ensure he is optimally prepared for this battle that has captured the attention of the entertainment and sports world."
https://www.fightbookmma.com/bkfc-48-lorenzo-hunt-and-chris-camozzi-to-corner-for-bryce-hall-and-gee-perez-on-august-11-in-albuquerque-nm,"“This fight has exceeded all expectations in regards to fan and media attention globally in addition to the robust advance ticket sales from the great fight fans in Albuquerque, New Mexico for Friday, August 11.”"
https://www.fightbookmma.com/watch-sitting-ringside-ep-183-at-9-p-m-et-on-august-4,"Roberto “El Jefe” Villa, CEO of FightBook MMA, hosts Sitting Ringside, LLC, and joining him are David Rodriguez, Mark Ambeau-Miller, and Producer/President of FightBook MMA Rudy “The Prophet” Lara."
https://www.fightbookmma.com/the-perks-of-loyalty-vip-programs-at-online-casinos,"Higher Bonus Rates: VIPs often enjoy more generous bonus rates, such as higher deposit bonuses and cashback percentages."
https://www.fightbookmma.com/the-perks-of-loyalty-vip-programs-at-online-casinos,"Faster Responses: VIP account managers prioritize VIP players, offering quicker responses to inquiries and resolving any issues promptly."
https://www.fightbookmma.com/the-perks-of-loyalty-vip-programs-at-online-casinos,"Increased Withdrawal Limits: VIPs often enjoy higher withdrawal limits, enabling them to cash out larger sums of money without restrictions."
https://www.fightbookmma.com/the-perks-of-loyalty-vip-programs-at-online-casinos,"VIP Events: Online casinos often organize special events for their VIP players, ranging from luxury vacations to exclusive parties."
https://www.fightbookmma.com/the-perks-of-loyalty-vip-programs-at-online-casinos,"Enhanced Loyalty Points: VIP players earn loyalty points at an accelerated rate, allowing them to redeem rewards more quickly."
https://www.fightbookmma.com/how-to-diversify-your-crypto-portfolio,"The decentralized characteristic of cryptos is a prominent factor in their success and growth. They rely on a peer-to-peer network that isn’t governed by any central power, such as financial institutions or governments. This provides users with more control over their funds and defends them against inflation and other economic pressures."
https://www.fightbookmma.com/how-to-diversify-your-crypto-portfolio,"Digital assets have become increasingly popular due to their potentially high returns. Many small cryptos with low market caps have observed remarkable price growth in a brief time, causing stories of investors becoming millionaires overnight and further boosting the number of people who are entering the crypto space looking for similar successes."
https://www.fightbookmma.com/how-to-diversify-your-crypto-portfolio,"Building a balanced crypto portfolio involves including different types of cryptos, from large-cap coins to mid and small-cap ones, plus stablecoins and other digital assets. The aim is to have an assortment of cryptos that can provide both expansion opportunities and dependability."
https://www.fightbookmma.com/how-to-diversify-your-crypto-portfolio,"Investing in a variety of assets can be an excellent way to offset risk and protect your portfolio from the mercurial nature of this market. By diversifying, you’re enabling yourself to profit even when one crypto takes a dip; for instance, if one coin experiences an abrupt decrease in value, its impact will be lessened by the presence of other crypto assets within your portfolio. Ultimately, having multiple coins ensures that losses are minimized while gains are maximized across the board."
https://www.fightbookmma.com/watch-sitting-ringside-ep-184-at-9-p-m-et-on-august-10,"Roberto “El Jefe” Villa, CEO of FightBook MMA, hosts Sitting Ringside, LLC, and joining him are David Rodriguez, Mark Ambeau-Miller, and Producer/President of FightBook MMA Rudy “The Prophet” Lara. Our guest co-host will be our writer Anik Subramanian."
https://www.fightbookmma.com/association-of-boxing-commissions-approves-unified-rules-for-bare-knuckle-fighting-in-the-united-states,"Said David Feldman, President and Founder of BKFC, “This is a pivotal moment in the growth of bare-knuckle fighting in the United States. Our growth in the first five years of the promotion has been extraordinary and this will heighten our ascent in this country. It’s a great day for BKFC fans in the United States.”"
https://www.fightbookmma.com/association-of-boxing-commissions-approves-unified-rules-for-bare-knuckle-fighting-in-the-united-states,"On Friday, August 25, BKFC returns to South Florida with BKFC-49 headlined by the BKFC Welterweight World Championship between #1 Ranked Gorjan ‘GoGo’ Slaveski, (5-0), of Macedonia now residing in South Florida, and #4 Ranked ‘Gypsy’ Jake Lindsey, (4-0), of Manhattan, Kansas from Arnold Hall at the Miami Dade Fairgrounds."
https://www.fightbookmma.com/association-of-boxing-commissions-approves-unified-rules-for-bare-knuckle-fighting-in-the-united-states,"BKFC will launch the BKFC Prospect Series on Thursday, August 24 the night before BKFC-49 at the same venue."
https://www.fightbookmma.com/introduction-to-dogecoin-casino-online,"Decentralized blockchain technology facilitates lightning-fast transactions in Dogecoin. Dogecoin transactions are processed swiftly, allowing players to deposit and withdraw funds nearly instantly compared to traditional payment systems, which may involve banks and intermediaries. The lack of waiting around improves the whole gambling experience."
https://www.fightbookmma.com/introduction-to-dogecoin-casino-online,"Dogecoin casino online transactions often have cheaper fees than other cryptocurrencies and even more conventional payment options. Both gamers and online casinos might gain from the cheaper fees. Because of the low transaction costs, casinos can provide attractive promos and bonuses without discouraging players from making lesser wagers."
https://www.fightbookmma.com/introduction-to-dogecoin-casino-online,"Due to Dogecoin’s widespread availability, players worldwide are no longer limited by their location when it comes to enjoying the thrills of online gaming. Dogecoin gambling is accessible worldwide to anyone with an internet connection and a Dogecoin-compatible wallet."
