url,input
https://www.fightbookmma.com/introduction-to-dogecoin-casino-online,The blockchain is a public ledger on which all Dogecoin transactions are recorded and may be verified at any time. This openness encourages fairness and trust among players by making it possible for the casino’s operations to be checked by other parties. The blockchain’s distributed
https://www.fightbookmma.com/introduction-to-dogecoin-casino-online,ledger structure makes committing fraud or manipulating the system harder.
https://www.fightbookmma.com/finding-the-right-dosage-avoiding-under-or-overconsumption,The Importance Of Finding The Optimal Dosage For Individual Needs
https://www.fightbookmma.com/finding-the-right-dosage-avoiding-under-or-overconsumption,"CBD is frequently used to treat various health issues, including chronic pain, anxiety, sleeplessness, and inflammation. CBD can interact with the body’s endocannabinoid receptors, providing potential therapeutic benefits when taken at the correct dosage. However, taking too little CBD may not give the intended results, while taking too much CBD may overwhelm the system and result in declining returns or unpleasant side effects. Individuals can maximize the therapeutic effects of CBD by determining the ideal dosage, such as using 5000mg CBD oil, which has shown promising results in various studies."
https://www.fightbookmma.com/finding-the-right-dosage-avoiding-under-or-overconsumption,"Inadequate CBD use may result in no observable effects, causing some people to conclude that CBD is ineffective for them. This misperception may deter people from continuing their CBD regimen, even though it may be beneficial if the dosage is appropriately adjusted. Correct dosing guarantees consumers give CBD a fair chance to demonstrate its potential benefits."
https://www.fightbookmma.com/finding-the-right-dosage-avoiding-under-or-overconsumption,"Because everyone’s body is different, people may react differently to CBD depending on their biochemistry and genetic makeup. What works for one individual might not work for another. Individuals can customize their CBD intake to meet their needs and sensitivities by establishing the best dosage, boosting its efficiency for them."
https://www.fightbookmma.com/finding-the-right-dosage-avoiding-under-or-overconsumption,"CBD products can be costly, and taking the proper dosage ensures that people use them effectively. Finding the correct dosage can save money over time by eliminating excessive overconsumption and ensuring the product lasts longer."
https://www.fightbookmma.com/sessions-by-saint-laurent-talk-show-with-mystery-guest-live-sept-3-on-fite,FURY ROAD has a special 6pm start time. Grab tickets at MLW2300.com and the 2300 Arena box office. Tickets start at $15.
https://www.fightbookmma.com/sessions-by-saint-laurent-talk-show-with-mystery-guest-live-sept-3-on-fite,Promoter. Manager and now talk show host!?! Mister Saint Laurent promises a HUGE surprise for his first guest. Who will sit in with Saint Laurent for his first session?
https://www.fightbookmma.com/sessions-by-saint-laurent-talk-show-with-mystery-guest-live-sept-3-on-fite,"Promising a jaw-dropping mystery guest, Saint Laurent vows to pull out all the stops to ensure the premiere of his talk show is one for the books."
https://www.fightbookmma.com/sessions-by-saint-laurent-talk-show-with-mystery-guest-live-sept-3-on-fite,World Heavyweight ChampionshipAlex Kane (champion) vs. Willie Mack
https://www.fightbookmma.com/mlw-fusion-preview-for-tonight-from-mexico,Hammerstone steps into an MLW ring for the first time in over a month in this week’s main event of FUSION!
https://www.fightbookmma.com/mlw-fusion-preview-for-tonight-from-mexico,"While Alex Kane has enjoyed a fast and furious ascension to being World Champion, Willie Mack has endured a lifelong struggle to the top. Now, the veteran readies to realize the dream: win the world title. As the clock ticks down to Fury Road live and exclusively on FITE+, the Mack is in the house to speak on the big mouthed Bomaye Fight Club captain."
https://www.fightbookmma.com/mlw-fusion-preview-for-tonight-from-mexico,Jacob Fatu is the streets and looking to lock in on AKIRA and Rickey Shane Page after The Calling’s attack on Fatu’s cousin Lance Anoa’i last week.
https://www.fightbookmma.com/mlw-fusion-preview-for-tonight-from-mexico,The Second Gear Crew and Microman drink light beer and raise some hell.
https://www.fightbookmma.com/mlw-fusion-preview-for-tonight-from-mexico,The 6th round of the 2023 MLW Open Draft hits exclusively on FUSION. Who will be drafted?
https://www.fightbookmma.com/tracy-williams-vs-ichiban-signed-for-fury-road-on-fite,FURY ROAD has a special 6pm start time. Grab tickets at MLW2300.com and the 2300 Arena box office. Tickets start at $15.
https://www.fightbookmma.com/tracy-williams-vs-ichiban-signed-for-fury-road-on-fite,Will Williams grind down Ichiban with his world class grappling or will the newest MLW signee Ichiban unleash a fury of lethal puroresu?
https://www.fightbookmma.com/tracy-williams-vs-ichiban-signed-for-fury-road-on-fite,World Heavyweight ChampionshipAlex Kane (champion) vs. Willie Mack
https://www.fightbookmma.com/ufc-antitrust-lawsuit-achieves-class-action-status-a-game-changer-for-mma,"The “bout class” pertains to all fighters who participated in Zuffa events within North America between December 16, 2010, and June 30, 2017. Notably, this encompasses a broad spectrum of fighters who graced the octagon during this time frame. In contrast, the “identity class” revolved around a smaller group of fighters, focusing on those whose likenesses were utilized by Zuffa in merchandise and video games during the same period."
https://www.fightbookmma.com/ufc-antitrust-lawsuit-achieves-class-action-status-a-game-changer-for-mma,"The pivotal aspect of class certification is that approximately 1200 fighters who competed in the UFC throughout the stipulated time frame are now automatically included as plaintiffs unless they actively choose to “opt-out.” Spearheading the charge, the Named Plaintiffs — including luminaries like Cung Le, Jon Fitch, Kyle Kingsbury, Javier Vasquez, and Brandon Vera — will continue to represent the Class as the lawsuit progresses. Yet, it’s essential to underline that unless these representatives opt out, all members of the bout class stand to receive their share of any awarded damages. In a twist, the denial of the identity class certification has resulted in Nathan Quarry no longer occupying the position of named Plaintiff in this complex legal battle."
https://www.fightbookmma.com/ufc-antitrust-lawsuit-achieves-class-action-status-a-game-changer-for-mma,"The UFC, a colossal financial powerhouse, could nonetheless find itself grappling with the weight of such substantial damages. Remarkably, the Court has also validated the fighters’ “standing to bring their claims of injunctive relief,” adding an extra layer of vulnerability for the UFC. The possibility of mandated alterations to their business practices looms, potentially altering the very foundation that has propelled the UFC to its dominant stature."
https://www.fightbookmma.com/ufc-antitrust-lawsuit-achieves-class-action-status-a-game-changer-for-mma,"The core allegation by the fighters revolves around the UFC’s alleged violation of antitrust laws. The document emphatically underscores that “at least three named Plaintiffs were subject to that action when the Complaint was filed,” thus establishing the basis for their concrete injury traceable to the actions of the Defendant."
https://www.fightbookmma.com/ufc-antitrust-lawsuit-achieves-class-action-status-a-game-changer-for-mma,"The Court’s meticulous examination of the case over the years has yielded intriguing revelations. Foremost, the Court has unequivocally determined that the UFC “willfully engaged in anticompetitive conduct to maintain or increase their market power.” This damning indictment highlights a trifecta of methods through which the UFC advanced this conduct: enforcing exclusionary contracts, leveraging extracontractual strategies to perpetuate fighter contracts, and strategically acquiring and shuttering rivals."
https://www.fightbookmma.com/aniks-fire-forecast-28th-edition-picks-for-ufc-on-vegas-78-luque-vs-dos-anjos,Main Event Pick: #10 Vicente Luque over #9-LW Rafael Dos Anjos
https://www.fightbookmma.com/aniks-fire-forecast-28th-edition-picks-for-ufc-on-vegas-78-luque-vs-dos-anjos,"Other Picks: Marcus McGhee over JP Buys, Terrance McKinney over Mike Breeden, Martin Buday over Josh Parisian, Da’Mon Blackshear over Jose Johnson"
https://www.fightbookmma.com/bkfc-48-john-dodson-vs-jr-ridge-results,"The promotion will host BKFC-48 on Friday, August 11 at Tingley Coliseum with a sensational main event as local all-action attraction, #2 ranked John ‘The Magician’ Dodson, (2-0), battles #1 ranked JR ‘The Lion’ Ridge, (3-1), of Tampa, FL for the first ever BKFC Flyweight World Championship."
https://www.fightbookmma.com/bkfc-48-john-dodson-vs-jr-ridge-results,John Dodson vs. JR Ridge – for inaugural BKFC World Flyweight
https://www.fightbookmma.com/bkfc-48-john-dodson-vs-jr-ridge-results,"Joshua Moreno def. Jeremy Sauceda via TKO (corner stoppage) in Round 1, 5:00"
https://www.fightbookmma.com/bkfc-48-john-dodson-vs-jr-ridge-results,"Jeremie Holloway vs. Will Santiago ruled a majority draw (48-46, 47-47, 47-47)"
https://www.fightbookmma.com/bkfc-48-john-dodson-vs-jr-ridge-results,"Donald Sanchez def. Anthony Lacaze via unanimous decision (50-44, 48-46, 50-44)"
https://www.fightbookmma.com/ufc-on-espn-51-luque-vs-dos-anjos-results,"This event takes place Saturday, August 12, 2023, beginning at 4 p.m. ET (1 p.m. PT). The promotion will host the event at the UFC Apex in Las Vegas. The card airs on ESPN and streams on ESPN+."
https://www.fightbookmma.com/samantha-onate-leads-the-charge-to-a-successful-day-2-for-mexico-at-the-2023-immaf-pan-american-championships,"After Team USA took the top spot on Day 1, Mexico moved to pole position on the second day of proceedings, claiming 11 victories across all weight classes. 2022 Pan American gold medalist Samantha Oñate made it abundantly clear that she is a major threat to anyone at 145lbs, as she picked up her second win of the competition, this time over 2022 IMMAF World Championships bronze medalist Rabech Rufino."
https://www.fightbookmma.com/samantha-onate-leads-the-charge-to-a-successful-day-2-for-mexico-at-the-2023-immaf-pan-american-championships,"For the aforementioned Jade Vazquez, her toughest test may well be yet to come. Brazil’s Giulliany Perea, fresh off a decision win over Columbia’s Alison Vargas, will face off against Vazquez in the penultimate bout of the Women’s Senior Strawweight division."
https://www.fightbookmma.com/samantha-onate-leads-the-charge-to-a-successful-day-2-for-mexico-at-the-2023-immaf-pan-american-championships,"Another Brazilian athlete quickly making a name for himself is Guilherme Porto, who competes in the welterweight division. Porto picked up his second submission win of the tournament, catching Juan Contreras Silva in a rear naked choke, securing a spot opposite Trinidad & Tobago’s Joshua James."
https://www.fightbookmma.com/samantha-onate-leads-the-charge-to-a-successful-day-2-for-mexico-at-the-2023-immaf-pan-american-championships,"Finally, host nation Colombia continue to impress, with nine of their fighters leaving with their hand raised. Special mention should be given to El Salvador and Jamaica, who picked up their first wins of the tournament."
https://www.fightbookmma.com/veterans-stadium-showcase-results-from-quincy-ma,"“Veterans Stadium Showcase,” presented by Granite Chin Promotions (GCP), was streamed live from Veterans Memorial Stadium in Quincy, Massachusetts. Part of the proceeds went to Operation Homefront."
https://www.fightbookmma.com/veterans-stadium-showcase-results-from-quincy-ma,"Ohan, Jr., the former New England Welterweight Champion, showed poise and patience as he adjusted and eventually broke-down the always tough Gigliotti on his way to a convincing eight-round unanimous decision."
https://www.fightbookmma.com/veterans-stadium-showcase-results-from-quincy-ma,"Gigliotti came out firing clean, explosive shots in the first round, taking the fight right to Ohan, Jr., the former New England Welterweight Champion. Ohan. Jr. started beating Gigliotti to the punch in the second. The third was even and Ohan, Jr. established control in the second half of the fourth round, putting together his punches, which slowed down Gigliotti. As both fighters landed punch after punch in the fifth, Ohan, Jr. suddenly floored Gigliotti with a left to the body at the end of the round. Ohan, Jr. patiently and methodically took control as Gigliotti rode his bike in the sixth, moving much more away rather than towards Ohan, Jr,, who hurt Gigliotti with more body punches as the bell rang."
https://www.fightbookmma.com/veterans-stadium-showcase-results-from-quincy-ma,"“Everything leading up to this fight made me better for this fight and my future,” Ohan, Jr. said after the fight. “I hit him with a picture-perfect body shot, but he’s a really tough kid. The first two rounds were for adjustments. He felt my power punches and that body shot was the beginning of the end for him. I had to adjust to beat him on the inside and that’s how I broke him down. I wish O got the stoppage, but I had a great performance. There’s always work to do, though, to get to the top.”"
https://www.fightbookmma.com/veterans-stadium-showcase-results-from-quincy-ma,"The co-featured event was a middleweight unification bout between USBF champion Julien “Black Dragon” Baptiste, of Woburn (MA), and Massachusetts titleholder Jamer Jones, of Pittsfield (MA), in a great fight, one that would have been the Fight of the Night on most shows."
https://www.fightbookmma.com/how-to-watch-lucha-libre-aaa-mexico-city-triplemania-xxxi-online,"Chapter 1: Unleash the Titans: Triplemania XXXI Bundle brings together the titans of Lucha Libre for an unforgettable night of action. Feel the rush as iconic wrestlers step into the ring to showcase their athleticism and skill. The much-anticipated match between El Hijo del Fantasma and Psycho Clown promises to be a highlight of the night, leaving fans at the edge of their seats as they witness an intense battle for supremacy."
https://www.fightbookmma.com/how-to-watch-lucha-libre-aaa-mexico-city-triplemania-xxxi-online,"Chapter 2: Drama and Rivalries: Beyond the physicality, Triplemania XXXI Bundle delves into the emotional rivalries that define Lucha Libre. Brace yourself for a clash of personalities and history as Lady Shani and Faby Apache lock horns in a grudge match fueled by years of animosity. The ring becomes a canvas for their stories to unfold, captivating fans with each move and moment."
https://www.fightbookmma.com/how-to-watch-lucha-libre-aaa-mexico-city-triplemania-xxxi-online,"Chapter 4: Future Stars Shine: As the legends take their place, Triplemania XXXI Bundle also showcases the rising stars of Lucha Libre. Witness the energy and potential of the Young Bucks of AAA as they defend their tag team titles. This match is a glimpse into the future of the sport, where new talents step up to create their own legacy and thrill audiences worldwide."
https://www.fightbookmma.com/how-to-watch-joshua-vs-helenius-boxing-in-canada,Main Card: 7:00 pm BST / 11:00 am PT / 1:00 pm CT / 2:00 pm ET
https://www.fightbookmma.com/how-to-watch-joshua-vs-helenius-boxing-in-canada,"After Whyte’s reports were revealed, Matchroom was under extreme pressure to find a suitable opponent for Joshua to fig"
https://www.fightbookmma.com/how-to-watch-joshua-vs-helenius-boxing-in-canada,"DAZN is the home of all the major fights from the boxing world, and Joshua’s fight with Whyte was also scheduled to be broadcast through DAZN PPV, but with the change of the opponent, the fight has been announced to be part of a standard subscription."
https://www.fightbookmma.com/how-to-watch-joshua-vs-helenius-boxing-in-canada,"Like always, DAZN will live stream the packed action night in over 200 countries this weekend across the globe, and if you’re not subscribed to any plan, choose one of the following subscription plans DAZN provides and enjoy the action."
https://www.fightbookmma.com/how-to-watch-joshua-vs-helenius-boxing-in-canada,"* For just £9.99 per month, fans can buy a monthly subscription which commits them to an entire year."
https://www.fightbookmma.com/sixteen-athletes-are-ready-to-light-up-the-bogota-sky-at-brave-cf-73,"These professional athletes got to size up their opponents when they met during the ceremonial weigh-ins and face-offs before going to war. While proceedings were respectful, there was no lack of intensity."
https://www.fightbookmma.com/sixteen-athletes-are-ready-to-light-up-the-bogota-sky-at-brave-cf-73,"“BRAVE Combat Federation means so much to me, I finally have this moment, and I now get to live out my dream,” said Torres, a former Flyweight contender, who paid respects to his late father by wearing the colors of Chigaco’s notorious Harrison Gents gang in his hair."
https://www.fightbookmma.com/sixteen-athletes-are-ready-to-light-up-the-bogota-sky-at-brave-cf-73,"Ahead of their electric Super Welterweight clash, Brazil’s Luis Cado and Willker Lemos produced an intense staredown when they met face to face before both athletes let off a thunderous raw head."
https://www.fightbookmma.com/sixteen-athletes-are-ready-to-light-up-the-bogota-sky-at-brave-cf-73,"On the LFC prelim card, the excitement got the better of Colombia’s Mauricio Otalora and El Salavador’s Carlos Belloso before officials stepped in to douse the flames on stage."
https://www.fightbookmma.com/sixteen-athletes-are-ready-to-light-up-the-bogota-sky-at-brave-cf-73,Only one athlete failed to make the weight cut as Ecuador’s Diego Morillo stepped onto the scales at 71.7kg ahead of his Lightweight bout against Colombia’s Gabriel Bula.
https://www.fightbookmma.com/helenius-vs-anthony-joshua-live-streams-dazn-boxing,Main Card: 7:00 pm BST / 11:00 am PT / 1:00 pm CT / 2:00 pm ET
https://www.fightbookmma.com/helenius-vs-anthony-joshua-live-streams-dazn-boxing,"Like always, the time could change depending on the length of the fights on the undercard."
https://www.fightbookmma.com/helenius-vs-anthony-joshua-live-streams-dazn-boxing,"Originally scheduled for a rematch against Dillian Whyte, Joshua’s plans took an unexpected turn. Their initial encounter took place in 2015, culminating in Joshua’s seventh-round knockout victory over Whyte. However, the 35-year-old Whyte was withdrawn from the rematch due to a failed pre-fight drug test."
https://www.fightbookmma.com/ufc-on-espn-51-bonus-winners-luque-vs-dos-anjos,"This event took place Saturday, August 12, 2023. The promotion hosted the event at the UFC Apex in Las Vegas. The entire card aired on ESPN and also streamed on ESPN+."
https://www.fightbookmma.com/ufc-on-espn-51-bonus-winners-luque-vs-dos-anjos,UFC officials announced the bonus winners after the event. Each fighter took home an extra $50k.
https://www.fightbookmma.com/ufc-on-espn-51-venum-payout-cub-swanson-top-earner-with-21000,"This event took place Saturday, August 12, 2023. The promotion hosted the event at the UFC Apex in Las Vegas. The entire card aired on ESPN and also streamed on ESPN+."
https://www.fightbookmma.com/ufc-on-espn-51-venum-payout-cub-swanson-top-earner-with-21000,"Fighters took home their Venum payout totalling $173,000. Fighters with 1-3 bouts receive $4,000 per appearance; 4-5 bouts get $4,500; 6-10 bouts get $6,000; 11-15 bouts earn $11,000; 16-20 bouts pocket $16,000; and 21 bouts and more get $21,000. Additionally, champions earn $42,000 while title challengers get $32,000. In addition to the based pay, UFC fighters will receive perpetuity royalty payments amounting to 20-30% of any UFC merchandise sold that bears their likeness, according to officials."
https://www.fightbookmma.com/from-rock-bottom-to-the-top-jose-shorty-torres-is-the-new-brave-cf-bantamweight-champion,"Competing at the Coliseo El Salitre, stars from the USA, South Africa, Colombia, Brazil, Trinidad and Tobago, El Salvador, Peru, and Ecuador all shone on the most-global MMA stage as Latin America’s finest superstars mixed it up with the world’s best in the main attraction of the BRAVE Pan-American Combat Week."
https://www.fightbookmma.com/from-rock-bottom-to-the-top-jose-shorty-torres-is-the-new-brave-cf-bantamweight-champion,"Ndebele drew first blood in the first round with his teep-like kicks, knees to the midsection, and inside leg kicks to nullify Torres’ high-level wrestling. The South African looked very comfortable with his silky striking and reach, cutting his American opponent open with his knees in the clinch. At one point in the first round, Torres closed the distance and produced one of many hip tosses, but Ndebele did well to escape the moment he hit the canvas."
https://www.fightbookmma.com/from-rock-bottom-to-the-top-jose-shorty-torres-is-the-new-brave-cf-bantamweight-champion,"Torres realized that he’d need to close the distance and take the fight to Ndebele and started doing just that in the second round. Ndebele used his height to his advantage as Torres battled to implement a strong wrestling game, but the American’s experience and high level soon found him making inroads, using angles and quick bursts of leg kicks to try and weaken Ndebele’s lead leg that he relied on so much to strike from distance."
https://www.fightbookmma.com/from-rock-bottom-to-the-top-jose-shorty-torres-is-the-new-brave-cf-bantamweight-champion,"Instead of returning to the feet where he had been dominant with his striking, Ndebele opted to try and take the back of Torres, who then tossed his opponent again before transitioning from a Kimura to an arm bar. Torres’ work rate played a role in the judges’ books as the American had been more active in the clinch and in the grappling exchanges for the duration of the fight."
https://www.fightbookmma.com/from-rock-bottom-to-the-top-jose-shorty-torres-is-the-new-brave-cf-bantamweight-champion,"In round four, Torres continued working the lead leg of Nkosi, who went back to his bread and butter, landing kicks to Torres’ body while working his straight jabs. Torres used his angles to close the distance again and pulled out another impressive hip toss."
https://www.fightbookmma.com/vaquero-navarrete-outlasts-oscar-valdez-in-brutal-all-mexican-showdown,"But as the rounds progressed, Navarrete’s power made a difference as his left uppercuts and hooks caused swelling below Valdez’s right eye. In the fifth and sixth rounds, Valdez started to connect with counter left hooks. In the 10th, a war broke out in the center of the ring, with both fighters exchanging to win the final rounds."
https://www.fightbookmma.com/vaquero-navarrete-outlasts-oscar-valdez-in-brutal-all-mexican-showdown,"“I think the people can best talk about what they saw. They saw the fight tonight. I was here fighting with Valdez. And I feel good. Thank God, I won. I appreciate what he did in the ring. He is a Mexican warrior. If the people want a rematch, they will demand it.”Valdez said, “He is a warrior. I tried my best. We gave it our best. He is a warrior. He is a true champion. I’m sorry I disappointed everyone. I feel terrible. I wanted to give you all a great fight. I hope you enjoyed the fight. I hope to return strong.”"
https://www.fightbookmma.com/top-prospect-jorge-cobas-marin-secures-finale-spot-on-day-3-of-the-2023-immaf-pan-american-championships,"One of Mexico’s top prospects, Jorge Cobos Marin, demonstrated why there is such a buzz around his name, shutting down talented Peruvian Jose Ayquipa, and claiming his spot in the flyweight finals. Marin will face off against a veteran of the 2022 IMMAF World Championships in Luiz Henrique, who has gone 2-0 in the Pan American Championships so far."
https://www.fightbookmma.com/top-prospect-jorge-cobas-marin-secures-finale-spot-on-day-3-of-the-2023-immaf-pan-american-championships,"Despite fielding a significantly smaller squad than the like of Mexico, Colombia or USA, El Salvador will have an athlete representing them in the finals. 27-year-old Rodrigo Jose Lopez Calderon overcame potent KO artist Ijaz Cave in the middleweight semi-finals, setting up an all-action bout vs. Team USA’s Jake Christensen. The American has a 100% finish rate in the tournament so far, with his move down from light heavyweight appearing to be paying dividends."
https://www.fightbookmma.com/top-prospect-jorge-cobas-marin-secures-finale-spot-on-day-3-of-the-2023-immaf-pan-american-championships,"Up at the Super Heavyweight division, 2022 Pan American silver medallist Anthony Ramirez scored an impressive TKO over Lincoln Nazareno. The native of Puerto Rico is set for a showdown in the finals against IMMAF newcomer, Gerardo Daniel Trujillo Munguia, another product of the streaking Team Mexico."
https://www.fightbookmma.com/top-prospect-jorge-cobas-marin-secures-finale-spot-on-day-3-of-the-2023-immaf-pan-american-championships,"After a closely contested affair, it was the former two-time IMMAF World Champion, Jose Torres, who was left with his hand raised and the bantamweight belt around his waist."
https://www.fightbookmma.com/emmanuel-rodriguez-secures-ibf-bantamweight-title-with-unanimous-decision-over-melvin-lopez,"Rodriguez (22-2, 13 KOs) sustained swelling over his right eye in the second round of the 12-round battle, and even though the eye ballooned as the fight wore on, he outclassed his opponent to the tune of 120-105 scores in his favor from all three judges."
