url,input
https://www.fightbookmma.com/emmanuel-rodriguez-secures-ibf-bantamweight-title-with-unanimous-decision-over-melvin-lopez,"“I remained calm despite the headbutt that caused my eye to swell up in the second round. It kept getting more swollen, but my team did an outstanding job keeping it at bay. I never had a problem with my eyesight throughout the fight.”"
https://www.fightbookmma.com/emmanuel-rodriguez-secures-ibf-bantamweight-title-with-unanimous-decision-over-melvin-lopez,"Rodriguez put an exclamation point on the victory by knocking down Lopez (29-2, 19 KOs) three times in the final round, attacking him with a flurry of punches that put Lopez on the ropes."
https://www.fightbookmma.com/emmanuel-rodriguez-secures-ibf-bantamweight-title-with-unanimous-decision-over-melvin-lopez,"“I want Santiago next. He says that he doesn’t think anybody can beat him at 118 pounds, but I’m here to prove him wrong.”"
https://www.fightbookmma.com/emmanuel-rodriguez-secures-ibf-bantamweight-title-with-unanimous-decision-over-melvin-lopez,"Lopez said he appreciated the opportunity to square off with Rodriguez, and thought he had a chance late in the fight to emerge victorious."
https://www.fightbookmma.com/jose-shorty-torres-becomes-third-khk-team-bahrain-athlete-to-wear-a-brave-cf-belt,"Torres joins a distinguished list of KHK Team Bahrain athletes to hold a BRAVE CF title – including current Super Lightweight champion Eldar Eldarov and former Lightweight champion Ahmed Amir. Torres did well to face adversity in the early rounds of the five-round fight as Ndebele was very comfortable at range working body and head shots with his slick striking. He quickly realized that in order for him to do any significant damage, he would have to work his angles to close the distance and implement that high-level wrestling of his. Despite securing a big takedown in the first round, it was late in the second round that Torres started finding his timing and rhythm that built the foundation for him to unleash more takedowns, clinch work, and superior grappling."
https://www.fightbookmma.com/watch-the-full-episode-of-ufc-292-countdown,"UFC makes its highly anticipated return to Boston with two compelling championship bouts. This event will take place Saturday, August 19, 2023, at TD Garden with the main card at 10 p.m. ET/7 p.m. PT on ESPN+ PPV. The prelims will be seen on ESPN, ESPN Deportes, and ESPN+ at 8 p.m. ET/5 p.m. PT with the night’s action starting at 6 p.m. ET/3 p.m. PT with Early Prelims on ESPN+ (English and Spanish) and UFC Fight Pass."
https://www.fightbookmma.com/watch-the-full-episode-of-ufc-292-countdown,"In the co-main event, UFC strawweight champion Zhang Weili (23-3) fighting out of Beijing, China has her sights set on making her second reign as champion a dominant one. takes on No. 4 Amanda Lemos (13-2-1) fighting out of Para, Brazil strives to shock the world in the biggest opportunity of her MMA career."
https://www.fightbookmma.com/chordale-the-gift-booker-scorches-nicolas-hernandez-at-summer-heat-2023,"With the win, Booker retained the WBC US Super Welterweight title that he won at the same venue in April of this year. It was the third fight of 2023 for ‘The Gift,’ who was sharp from the opening bell."
https://www.fightbookmma.com/chordale-the-gift-booker-scorches-nicolas-hernandez-at-summer-heat-2023,Booker took control of the fight in the opening round with sharp right jabs to Hernandez’s head and body. His game plan was to capitalize off the mistakes of his 39-year-old opponent with stinging counter shots.
https://www.fightbookmma.com/chordale-the-gift-booker-scorches-nicolas-hernandez-at-summer-heat-2023,"“He was reaching with his shots from the beginning, so I wanted to take advantage of that” explained Booker, who threw short, compact counter lefts hands and a sneaky right uppercut in round 2. “When he would throw his left hand, I would roll and come back with my left hand.”"
https://www.fightbookmma.com/chordale-the-gift-booker-scorches-nicolas-hernandez-at-summer-heat-2023,"“I was changing up my shots,” explains Booker. “He was ok standing really close to me, so I started putting my punches together, changing the pace of the shots and occasionally sitting down on my punches. That’s what got him: I would hit him with a number of punches, then a hard one, then a number of punches again. He never knew which one would be hard, so it disoriented him.”"
https://www.fightbookmma.com/chordale-the-gift-booker-scorches-nicolas-hernandez-at-summer-heat-2023,"‘The Gift’ began delivering a one-sided beating in round 4, stunning Hernandez with a right hook. The patient and composed Booker couldn’t miss with his counter punches, and it looked like the end was near."
https://www.fightbookmma.com/applications-and-benefits-of-cbd-products-in-sports,"It is also often used as a pain relief medication, as it has been shown that CBD has pain-relieving properties and can be helpful for many scenarios, such as joint pain, muscle soreness, and even injury-related pain. There have also been instances of CBD muscle recovery, where several products have shown recovering properties, beneficial for athletes healing from an injury."
https://www.fightbookmma.com/applications-and-benefits-of-cbd-products-in-sports,"CBD is also known for its mental health properties, which promote relaxation and can help cope with anxiety and depression, which are two extremely common conditions, not only in the world in general but also in the field of sports and athletic competition."
https://www.fightbookmma.com/applications-and-benefits-of-cbd-products-in-sports,"So far, we have shown some of the applications and benefits of this natural substance. When considering it as a possible treatment for several matters, it is important to take into consideration the fact that it is quite a new industry. Therefore its regulations are still improving and developing."
https://www.fightbookmma.com/mexico-usa-both-claim-8-gold-medals-in-the-finals-of-the-2023-immaf-pan-american-championships,"At the start of the night, it appeared Mexico would be the frontrunner to top the medal table. Their Junior athletes were extremely impressive, claiming six out of the seven gold medals available. Of particular note was Diego Torres Rangel who built on his success at the 2022 IMMAF World Championships, submitting Colombia’s Brayam Mora Umbarila to claim gold at 170lbs."
https://www.fightbookmma.com/mexico-usa-both-claim-8-gold-medals-in-the-finals-of-the-2023-immaf-pan-american-championships,"As the Senior finals began, it was Teams USA and Brazil that began to catch up with Mexico. Brazil put on a number of sensational highlight reel finishes, as Josiane Oliveira landed a picture-perfect spinning back kick to the midriff of Daniela Galvis leading to the TKO stoppage."
https://www.fightbookmma.com/mexico-usa-both-claim-8-gold-medals-in-the-finals-of-the-2023-immaf-pan-american-championships,"Defending Pan American Strawweight champ Giulliany Perea also picked up an impressive win, submitting Mexico’s Jade Vazquez with a well-executed rear naked choke, whilst Ana Vitoria Diniz‘s lightning-fast armbar will be played on her highlight reel for years to come."
https://www.fightbookmma.com/mexico-usa-both-claim-8-gold-medals-in-the-finals-of-the-2023-immaf-pan-american-championships,"Up at Featherweight, Christian Ammons landed a perfect head kick on Arturo Castillejos, leading to the finished sequence, and a gold medal. Gloria Dacosta upset Brazil’s impressive run of form, finishing skilled Brazilian prospect Fernanda Guersone with strikes from top control."
https://www.fightbookmma.com/mexico-usa-both-claim-8-gold-medals-in-the-finals-of-the-2023-immaf-pan-american-championships,"Jake Christensen and Lester Batres were both involved in thrilling back-and-forths, taking on a pair of extremely talented opponents. Batres especially was forced to overcome huge adversity, rallying late in the fight to get the TKO stoppage."
https://www.fightbookmma.com/rising-stars-arabia-boxing-series-to-unveil-the-dawn-of-arab-boxing-showcasing-the-uaes-middle-east-regions-elite-talent,"“Seddiqi Sports has pioneered the sport in the region, and we recently celebrated our 10-year anniversary of opening Round 10 boxing club in the UAE,” AAM Seddiqi Sports Founder Ahmed A. Seddiqi said. “It’s time to show the world that in addition to hosting major events in the region, we also have homegrown talents that can perform at the highest level of boxing and become superstars of the sport. We are proud to host this monumental boxing event in Abu Dhabi and would like to thank DCT Abu Dhabi for believing in us and putting its trust in the RSA platform.”"
https://www.fightbookmma.com/rising-stars-arabia-boxing-series-to-unveil-the-dawn-of-arab-boxing-showcasing-the-uaes-middle-east-regions-elite-talent,"“The arrival of Rising Stars Arabia in the emirate further cements Abu Dhabi’s status as a regional hub for combat sports and other major athletic events and franchises,” commented HE Saleh Al Geziry, Director General for Tourism at DCT Abu Dhabi. We remain committed to enabling the development of homegrown talent and are proud to support this impressive line-up of Emirati and Arab fighters who are helping to promote and elevate the sport in the UAE and wider regions. With this ground-breaking fight series, not only are we nurturing a sport, but we are also proving once again that Abu Dhabi is a premier tourism destination offering diverse and exciting entertainment experiences to our residents and visitors from around the world.”"
https://www.fightbookmma.com/rising-stars-arabia-boxing-series-to-unveil-the-dawn-of-arab-boxing-showcasing-the-uaes-middle-east-regions-elite-talent,"The 10-round co-main event will pit undefeated UAE super flyweight prospect Sultan Al Nuaimi (9-0-0, 6KOs) against Jemsi Kibazange (18-6-3, 5KOs), of Tanzania. Al Nuami, known for his speed and agility, made waves with his most impressive career performance at the last event promoted by Matchroom Boxing in Abu Dhabi. He is one of only a few professional boxers in the UAE, where he was an amateur champion, and he is expected to put on a thrilling show for his home crowd."
https://www.fightbookmma.com/rising-stars-arabia-boxing-series-to-unveil-the-dawn-of-arab-boxing-showcasing-the-uaes-middle-east-regions-elite-talent,"Bader Samreen (8-0-0, 7KOs) is a titan from Jordan’s professional boxing scene and a bronze medalist as an amateur at the World Championships. Seven of his eight victories to date as a professional have been by way of jaw-dropping knockouts, each more electrifying than the last. Samreen will be stepping into the ring against a tough, experienced Mexican fighter, lightweight Jose “Cuate” Gonzales (16-2-2, 12KOs), who’s vast skills ensure a memorable fight."
https://www.fightbookmma.com/rising-stars-arabia-boxing-series-to-unveil-the-dawn-of-arab-boxing-showcasing-the-uaes-middle-east-regions-elite-talent,"Other fighters participating in this special event include a pair of Egyptian Olympians, cruiserweight Youssef Karrar (1-0-0, 0KO) and welterweight Marwan Mohamad Madboly (2-0-0, 1KO). Additional bouts will include fighters from Iran, Bahrain, and Morocco."
https://www.fightbookmma.com/brave-pan-american-combat-week-yet-another-successful-trip-for-the-most-global-mma-promotion,"As the Pan-American Championship closes out with its final medal ceremony, the week-long fight festival will become the biggest combat sports festival in Latin American and Colombia’s history."
https://www.fightbookmma.com/brave-pan-american-combat-week-yet-another-successful-trip-for-the-most-global-mma-promotion,The event was a resounding success as 550 athletes from 62 federations descended upon Belgrade to compete in Europe’s biggest combat sports festival before BRAVE CF 69 capped the ground-breaking week in style with an epic professional show in the nation’s capital.
https://www.fightbookmma.com/brave-pan-american-combat-week-yet-another-successful-trip-for-the-most-global-mma-promotion,"The impact made by BRAVE Combat Federation, the International Mixed Martial Arts Federation, and the Serbian Mixed Martial Arts Federation was to such an extent that the Serbian government officially endorsed MMA as a sport and announced the inclusion of MMA as part of the sports development initiative of Serbia. It was a great moment for the sport, its fans, and the Serbian tourism industry."
https://www.fightbookmma.com/brave-pan-american-combat-week-yet-another-successful-trip-for-the-most-global-mma-promotion,"In 2019, BRAVE Combat Federation, in collaboration with the International Mixed Martial Arts Federation, hosted the biggest International Combat Week at the time when the IMMAF World Championships took place in Isa Town, Bahrain, which was followed by the BRAVE CF 29 fight card, also marking the biggest mixed martial arts festival in Asia."
https://www.fightbookmma.com/brave-pan-american-combat-week-yet-another-successful-trip-for-the-most-global-mma-promotion,"After a two-year hiatus and crowd less events at the BRAVE CF headquarters, His Highness Sheikh Khaled bin Hamad Al Khalifa, First Deputy Chairman of the Supreme Council for Youth and Sports, President of the Public Sports Authority, and President of the Bahrain Olympic Committee, inaugurated the activities of the BRAVE International Combat Week 2022."
https://www.fightbookmma.com/ufc-292-embedded-vlogs-series-episode-1,"In episode #1, Champions Aljamain Sterling and Zhang Weili take their challengers seriously; Sean O’Malley and Amanda Lemos game plan for gold. Marlon “Chito” Vera prepares for a cross-country work trip."
https://www.fightbookmma.com/ufc-292-embedded-vlogs-series-episode-1,"In the main event, UFC bantamweight champion Aljamain Sterling (23-3) fighting out of Uniondale, N.Y. looks to make a statement and cement himself as the greatest bantamweight in UFC history. He plans to silence #2 ranked contender Sean O’Malley (16-1 1NC) fighting out of Glendale, Ariz. as he intends to make the most of his first title opportunity by landing another signature knockout."
https://www.fightbookmma.com/ufc-292-embedded-vlogs-series-episode-1,"In the co-main event, UFC strawweight champion Zhang Weili (23-3) fighting out of Beijing, China has her sights set on making her second reign as champion a dominant one. takes on #4 Amanda Lemos (13-2-1) fighting out of Para, Brazil strives to shock the world in the biggest opportunity of her MMA career."
https://www.fightbookmma.com/new-wbc-bantamweight-champ-alexandro-santiago-expects-keeping-the-title-will-be-even-harder-than-his-uphill-climb-to-win-it,"Fighting on the televised undercard of the Errol Spence Jr. vs. Terence Crawford pay-per-view superfight on Saturday, July 29 at the T-Mobile Arena in Las Vegas, Santiago (28-3-5, 14 KOs), from Tijuana, Baja California, Mexico, notched a unanimous decision victory over “The Filipino Flash” Donaire by scores of 115-113, 116-112 and 116-112."
https://www.fightbookmma.com/new-wbc-bantamweight-champ-alexandro-santiago-expects-keeping-the-title-will-be-even-harder-than-his-uphill-climb-to-win-it,"“It was an accident,” explained Santiago. “The top floor of the house, where my relatives were staying, burned down. I live with my parents right now and, thankfully, the firefighters were able to stop the fire before it got to the first floor.”"
https://www.fightbookmma.com/new-wbc-bantamweight-champ-alexandro-santiago-expects-keeping-the-title-will-be-even-harder-than-his-uphill-climb-to-win-it,"Santiago, who has had to endure no less than five controversial draws in his 10-year career, including one against then IBF junior bantamweight titlist Jerwin Ancajas for the title in September 2018, says that nothing thrown his way was going to affect his second chance at a world title."
https://www.fightbookmma.com/new-wbc-bantamweight-champ-alexandro-santiago-expects-keeping-the-title-will-be-even-harder-than-his-uphill-climb-to-win-it,The 27-year-old Santiago says he enjoyed a welcoming reception upon returning home from the victory.
https://www.fightbookmma.com/new-wbc-bantamweight-champ-alexandro-santiago-expects-keeping-the-title-will-be-even-harder-than-his-uphill-climb-to-win-it,"“A lot of my family couldn’t travel to watch the fight, so it was an amazing reception everybody was on the street waiting for me. I felt this overwhelming joy they were so proud of me. I worked so hard most of my life and it’s an amazing feeling to have achieved this finally."
https://www.fightbookmma.com/exclusive-interview-with-george-groves-i-tried-to-make-one-final-match-against-james-degale-in-westfield-but-he-wanted-too-much-money,"Whilst you think, George Groves gave Genting Casino a great retrospective of his career which I would love to share with you!"
https://www.fightbookmma.com/exclusive-interview-with-george-groves-i-tried-to-make-one-final-match-against-james-degale-in-westfield-but-he-wanted-too-much-money,"My story ended up winning a world title at the fourth attempt, a story of unwavering self-confidence and self belief, as well as resilience. Balls of steel resilience. Don’t get me wrong, when I first turned pro, I didn’t want that to be the story. I wanted my story to be the greatest of all time, a multi-weight, unified world champion, a hall of fame legend. But that’s not how boxing goes."
https://www.fightbookmma.com/exclusive-interview-with-george-groves-i-tried-to-make-one-final-match-against-james-degale-in-westfield-but-he-wanted-too-much-money,"“I’d love to have won that first fight against Froch. I certainly would have loved to have won the rematch at Wembley, where I got knocked out, where I got my lights turned off in front of a record attendance crowd for British boxing, which was just horrific. And from there on in my career is never going to be what I’d hoped it to be. If I’d won at Wembley, then maybe even with a blip in the first fight, I’d been back up to full momentum. I might have had a different route as a world champion. I could have obviously capitalised from that momentum."
https://www.fightbookmma.com/exclusive-interview-with-george-groves-i-tried-to-make-one-final-match-against-james-degale-in-westfield-but-he-wanted-too-much-money,"It was uncharted territory after defeat at Wembley. I don’t know if there is a person on the planet who could have put his arm around me and told me ‘this happened to me, this is what you need to think and feel, this is how you go about it.’ I am single minded and resolute about my direction and my purpose in boxing, so I’ve got to now carry on.. And I remember in the cab home from Wembley, I Tweeted saying, ‘I just got knocked the fuck out’. And that tweet done really well, 85,000 fucking retweets or something. Much more than any other post I did, pre fight or since. So I tried to show humour."
https://www.fightbookmma.com/exclusive-interview-with-george-groves-i-tried-to-make-one-final-match-against-james-degale-in-westfield-but-he-wanted-too-much-money,I tried to make one final match against James Degale in Westfield – but he wanted too much money!
https://www.fightbookmma.com/immaf-president-kerrith-brown-could-not-be-prouder-of-immaf-alumni-jose-torres-and-nkosi-ndebele,"Torres and former IMMAF African gold medalist Ndebele are shining examples of the great system put in place by the global amateur governing body and BRAVE Combat Federation, and President Brown could not be prouder of these two stars who have become household names on the professional circuit since. “It’s been a great night of fighting, the main event with Torres and Ndebele, it was really technical, it was just a very proud moment just to see two IMMAF athletes of Ndebele and Torres’ caliber compete on this level,” said Brown in a post-fight interview."
https://www.fightbookmma.com/immaf-president-kerrith-brown-could-not-be-prouder-of-immaf-alumni-jose-torres-and-nkosi-ndebele,"“To see the ‘old vs new’ champions come through … it’s really exciting. It was a great technical fight, and I really enjoyed it,” said Brown, who highlighted Torres’ incredible Judo hip tosses, which played a huge role in him getting the nod from the judges at the end of the 25 minutes. “As a former Olympian Judo bronze medalist, just to see Torres activating his Judo and understanding what was needed to get the upper hand, it was exciting,” said Brown. “Torres is a shining example of how a mixed martial artist activates various skills and scores points. Those takedowns helped him win the BRAVE CF World Championship.”"
https://www.fightbookmma.com/immaf-president-kerrith-brown-could-not-be-prouder-of-immaf-alumni-jose-torres-and-nkosi-ndebele,President Brown also praised BRAVE Combat Federation and IMMAF for the collaboration and incredible work done since the two brands came together almost seven years ago.
https://www.fightbookmma.com/immaf-president-kerrith-brown-could-not-be-prouder-of-immaf-alumni-jose-torres-and-nkosi-ndebele,"The BRAVE Pan-American Combat Week – made possible by BRAVE CF, IMMAF, the Colombian Association of Mixed Martial Arts (OCAMM), and the Latin Fighter Championship (LFC) – is the second International Combat Week hosted outside of Bahrain."
https://www.fightbookmma.com/kevin-blackwood-debut-match-set-for-mlw-sept-3-in-philly,FURY ROAD has a special 6pm start time. Grab tickets at MLW2300.com and the 2300 Arena box office. Tickets start at $15.
https://www.fightbookmma.com/kevin-blackwood-debut-match-set-for-mlw-sept-3-in-philly,"In a triple threat bout showcasing the middleweight division, Kevin Blackwood looks to enter MLW and instantly get into the mix for a title shot. To do so he’ll have to contender with two middleweights hungry for gold in TJ Crawford and Alec Price."
https://www.fightbookmma.com/kevin-blackwood-debut-match-set-for-mlw-sept-3-in-philly,"Known as the “Silver Sniper,” Crawford has quickly impressed matchmakers with precision as a technical beast. A win in this triple threat bout could cement his contention for a title fight."
https://www.fightbookmma.com/kevin-blackwood-debut-match-set-for-mlw-sept-3-in-philly,"Tattooing opponents with vicious strikes and shutting them down with top level grappling, Blackwood looks to make an instant splash in MLW’s middleweight division with a decisive win over two emerging threats in the division."
https://www.fightbookmma.com/kevin-blackwood-debut-match-set-for-mlw-sept-3-in-philly,"Fighting out of Buffalo, NY, Blackwood is a 6-year pro, known for an extraordinary Top Rope Double Stomp. Will he unleash it en route to victory at FURY ROAD?"
https://www.fightbookmma.com/two-titles-on-the-line-at-ksw-85-this-saturday,"Parnasse is the current KSW lightweight & featherweight title holder and one of the top prospects in the world today. The 25-year-old has held the 145 lb strap since KSW 65 at the end of 2021 – in what is his second reign of the division – and recently captured gold at 155 lb. During his quest for a second title, the undefeated Ruchala stepped in and won the interim-featherweight championship."
https://www.fightbookmma.com/two-titles-on-the-line-at-ksw-85-this-saturday,"In the co-main event, light heavyweight champ Ibragim Chuzhigaev (17-5) goes up against KO machine Bogdan Gnidko (10-0) in what should be a thrilling encounter."
https://www.fightbookmma.com/two-titles-on-the-line-at-ksw-85-this-saturday,"Chuzhigaev won the title thanks to a five-round masterclass performance against the former longtime champ Tomasz Narkun and has since defended once against Ivan Erslan in another five-round battle. On the flip side, Gnidko has yet to leave the first round in his ten professional fights and his total fight time in KSW stands at just under 140 seconds in three outings. Anything can happen in this fight."
https://www.fightbookmma.com/two-titles-on-the-line-at-ksw-85-this-saturday,"XTB KSW 85 will be available to watch live around the world on www.KSWTV.com and exclusively live on Viaplay in the UK, Scandinavia, the Balkans, Poland, and the Netherlands."
https://www.fightbookmma.com/two-titles-on-the-line-at-ksw-85-this-saturday,Fans in Brazil can watch live on Combate while French fans can watch on RMC Sport.
https://www.fightbookmma.com/mcgregor-mma-boxing-odds-for-4-fights,"There’s been a recent KSI callout, unending Nate Diaz rumors (boxing/MMA), Justin Gaethje, Michael Chandler and more. Might as well throw a rematch with Floyd Mayweather on top just for fun."
https://www.fightbookmma.com/mcgregor-mma-boxing-odds-for-4-fights,"However, SportsBetting.ag went ahead and posted some fun odds for the four fights that McGregor (and others) are teasing to take place sometime in the next decade."
https://www.fightbookmma.com/mcgregor-mma-boxing-odds-for-4-fights,"If you are able to use this information, please consider citing the source."
https://www.fightbookmma.com/mcgregor-mma-boxing-odds-for-4-fights,McGregor boxing bouts odds are here: https://www.sportsbetting.ag/sportsbook/futures-and-props/boxing-exhibition
